{
  "actor": {
    "id": "cursor-session",
    "kind": "local"
  },
  "at": "2026-06-14T06:59:03Z",
  "event": "gcw-pr-publish",
  "event_id": "gcw-unknown-007-gcw-pr-publish",
  "parent": {
    "expected_last_seq": 6
  },
  "payload": {
    "body_hash": "sha256:ccff6e68bf61a5b0a33664a39d33f62b1d9373ae99935013714212989abbabed",
    "effects": [
      {
        "body_hash": "sha256:ccff6e68bf61a5b0a33664a39d33f62b1d9373ae99935013714212989abbabed",
        "kind": "github_pr_upsert",
        "operation_id": "gcw-pr-publish",
        "remote_updated_at": "",
        "status": "applied",
        "target": "https://github.com/fzf-labs/gcw/pull/10"
      }
    ],
      "progress_comment_url": "https://github.com/fzf-labs/gcw/issues/9#issuecomment-4700985131",
    "rendered_from_event_id": "gcw-unknown-006-gcw-implement-check",
    "review_request_url": "https://github.com/fzf-labs/gcw/pull/10"
  },
  "refs": {},
  "schema": "gcw.event/v1",
  "seq": 7
}
