{
  "actor": {
    "id": "cursor-session",
    "kind": "local"
  },
  "at": "2026-06-14T06:58:20Z",
  "event": "gcw-implement-check",
  "event_id": "gcw-unknown-006-gcw-implement-check",
  "parent": {
    "expected_last_seq": 5
  },
  "payload": {
    "gate": {
      "checks": [
        {
          "id": "diff-boundary",
          "ok": true
        },
        {
          "id": "no-secrets",
          "ok": true
        },
        {
          "id": "no-conflict-markers",
          "ok": true
        },
        {
          "id": "tests-pass",
          "ok": true
        }
      ],
      "errors": [],
      "ok": true,
      "validation": [
        {
          "command": "python3 -m unittest discover -s .agents/skills/gcw/tests",
          "exit_code": 0,
          "result": "63 tests passed"
        },
        {
          "command": "python3 -m unittest discover -s .agents/skills/gcw-issue-prepare/tests",
          "exit_code": 0,
          "result": "12 tests passed"
        },
        {
          "command": "evaluate_issue_readiness.py --body-file github_issue_form_body.md",
          "exit_code": 0,
          "result": "gate.ok true"
        },
        {
          "command": "validate_gcw_evidence.py workflow --issue-dir .gcw/issues/9",
          "exit_code": 0,
          "result": "ok"
        }
      ]
    },
      "progress_comment_url": "https://github.com/fzf-labs/gcw/issues/9#issuecomment-4700983183",
    "review_request": {
      "issue_link": "https://github.com/fzf-labs/gcw/issues/9",
      "summary": "Add CONTRIBUTING.md, GitHub Issue Form aligned with issue-template.md, optional labels sync workflow, and readiness fixture test",
      "title": "\u5f00\u53d1\u8005\u4e0a\u624b\u4e0e Issue \u6a21\u677f\u6807\u51c6\u5316\uff08P2\uff09"
    },
    "reviewer_notes": "CONTRIBUTING complements docs/quickstart.md. Issue form uses markdown section headers for prepare gate. Labels sync is workflow_dispatch only.",
    "risks": "GitHub Issue Form rendered body may differ slightly from fixture if GitHub changes form layout; verify on first real issue if needed",
    "scope": "CONTRIBUTING.md, README, .github/ISSUE_TEMPLATE/, .github/workflows/gcw-labels-sync.yml, readiness test fixture",
    "self_review": {
      "progress_section": "Phases 2-5 complete in task_plan.md",
      "recorded": true
    },
    "spec_refs": {
      "findings_sha": "sha256:e9f901367da6c5f2348d3dabe7a88d03b78b7739403c6d0197bdc808136622ab",
      "progress_sha": "sha256:36d87a10f8f06cb855b565b1ccf966d96e2ec70938414059134cd16c2d863146",
      "task_plan_sha": "sha256:4821651f4de293cb08e11a689ba633b4a949d894f0895e6d23e5822d5df97153"
    }
  },
  "refs": {},
  "schema": "gcw.event/v1",
  "seq": 6
}
