{
  "actor": {
    "id": "cursor-session",
    "kind": "local"
  },
  "at": "2026-06-16T10:47:45Z",
  "event": "gcw-issue-intake",
  "event_id": "gcw-19-000-gcw-issue-intake",
  "parent": {
    "expected_last_seq": -1
  },
  "payload": {
    "branch": "gcw/issue-19",
    "issue": "19",
    "owner": {
      "id": "cursor-session",
      "kind": "local"
    },
    "platform": "github",
    "repository": "fzf-labs/gcw"
  },
  "refs": {
    "branch": "gcw/issue-19",
    "issue": "19"
  },
  "schema": "gcw.event/v1",
  "seq": 0
}
