{
  "actor": {
    "id": "cursor-session",
    "kind": "local"
  },
  "at": "2026-06-13T11:12:08Z",
  "event": "gcw-implement",
  "event_id": "gcw-42-004-gcw-implement",
  "parent": {
    "expected_last_seq": 3
  },
  "payload": {
    "work_summary": "Implemented the example fixture capability."
  },
  "refs": {
    "base_branch": "",
    "branch": "feat/example-42",
    "issue": 42
  },
  "schema": "gcw.event/v1",
  "seq": 4
}
