{
  "actor": {
    "id": "cursor-session",
    "kind": "local"
  },
  "at": "2026-06-14T06:59:47Z",
  "event": "gcw-pr-review",
  "event_id": "gcw-unknown-008-gcw-pr-review",
  "parent": {
    "expected_last_seq": 7
  },
  "payload": {
    "feedback_source": "pr-review",
      "progress_comment_url": "https://github.com/fzf-labs/gcw/issues/9#issuecomment-4700986612",
    "result": "passed"
  },
  "refs": {},
  "schema": "gcw.event/v1",
  "seq": 8
}
