{
  "actor": {
    "id": "cursor-session",
    "kind": "local"
  },
  "at": "2026-06-14T06:32:12Z",
  "event": "gcw-spec-check",
  "event_id": "gcw-unknown-004-gcw-spec-check",
  "parent": {
    "expected_last_seq": 3
  },
  "payload": {
    "gate": {
      "checks": [],
      "errors": [],
      "ok": true
    },
      "progress_comment_url": "https://github.com/fzf-labs/gcw/issues/9#issuecomment-4700930261",
    "result": "passed"
  },
  "refs": {},
  "schema": "gcw.event/v1",
  "seq": 4
}
