{
  "actor": {
    "id": "cursor-session",
    "kind": "local"
  },
  "at": "2026-06-13T13:37:12Z",
  "event": "gcw-implement",
  "event_id": "gcw-unknown-004-gcw-implement",
  "parent": {
    "expected_last_seq": 3
  },
  "payload": {
    "work_summary": "Implement docs/quickstart.md and navigation links per spec"
  },
  "refs": {},
  "schema": "gcw.event/v1",
  "seq": 4
}
