{
  "actor": {
    "id": "cursor-session",
    "kind": "local"
  },
  "at": "2026-06-13T12:40:54Z",
  "event": "gcw-issue-to-spec",
  "event_id": "gcw-unknown-002-gcw-issue-to-spec",
  "parent": {
    "expected_last_seq": 1
  },
  "payload": {
    "planning_commit_pushed": true,
    "progress_comment_url": "https://github.com/fzf-labs/gcw/issues/5#issuecomment-4698546518",
    "spec_refs": {
      "findings_sha": "sha256:176a64b2714e7800b1e1e19aef937def8895149a5400c6419085d11b24d688a1",
      "progress_sha": "sha256:d688170d1c85b68be7eb31a0b8618d193f9fe460d46fbb89a79ec3b9a341a2ac",
      "task_plan_sha": "sha256:f4c70b77e3e2f9d6adf3b74dbe3c37d7347f9f9f2eb1316e7578d9738353d995"
    }
  },
  "refs": {},
  "schema": "gcw.event/v1",
  "seq": 2
}
