{
  "actor": {
    "id": "cursor-session",
    "kind": "local"
  },
  "at": "2026-06-14T09:30:51Z",
  "event": "gcw-implement",
  "event_id": "gcw-unknown-004-gcw-implement",
  "parent": {
    "expected_last_seq": 3
  },
  "payload": {
    "progress_comment_url": "https://github.com/fzf-labs/gcw/issues/11#issuecomment-4701336799",
    "work_summary": "Implement unified GCW step runner (run_gcw_step.py)"
  },
  "refs": {},
  "schema": "gcw.event/v1",
  "seq": 4
}
