{
  "actor": {
    "id": "cursor-session",
    "kind": "local"
  },
  "at": "2026-06-14T09:34:40Z",
  "event": "gcw-pr-publish",
  "event_id": "gcw-unknown-006-gcw-pr-publish",
  "parent": {
    "expected_last_seq": 5
  },
  "payload": {
    "body_hash": "sha256:daa209d61573075a7f96a60ce1234a9f7ec7a1c54ff790af31337c3a6783d020",
    "effects": [
      {
        "body_hash": "sha256:daa209d61573075a7f96a60ce1234a9f7ec7a1c54ff790af31337c3a6783d020",
        "kind": "github_pr_upsert",
        "operation_id": "gcw-pr-publish",
        "remote_updated_at": "",
        "status": "applied",
        "target": "fzf-labs/gcw#14"
      }
    ],
    "progress_comment_url": "https://github.com/fzf-labs/gcw/issues/11#issuecomment-4701345686",
    "rendered_from_event_id": "gcw-unknown-005-gcw-implement-check",
    "review_request_url": "https://github.com/fzf-labs/gcw/pull/14"
  },
  "refs": {},
  "schema": "gcw.event/v1",
  "seq": 6
}
