{
  "actor": {
    "id": "cursor-session",
    "kind": "local"
  },
  "at": "2026-06-13T17:23:18Z",
  "event": "gcw-implement-check",
  "event_id": "gcw-unknown-005-gcw-implement-check",
  "parent": {
    "expected_last_seq": 4
  },
  "payload": {
    "gate": {
      "checks": [
        {
          "id": "diff-boundary",
          "ok": true
        },
        {
          "id": "no-secrets",
          "ok": true
        },
        {
          "id": "no-conflict-markers",
          "ok": true
        },
        {
          "id": "tests-pass",
          "ok": true
        }
      ],
      "errors": [],
      "ok": true,
      "validation": [
        {
          "command": "python3 -m unittest discover -s .agents/skills/gcw/tests",
          "exit_code": 0,
          "result": "50 tests passed"
        },
        {
          "command": "validate_gcw_evidence.py workflow --issue-dir .gcw/issues/7",
          "exit_code": 0,
          "result": "ok"
        }
      ]
    },
    "review_request": {
      "issue_link": "https://github.com/fzf-labs/gcw/issues/7",
      "summary": "Add hard validation for GCW events and projections: schema hardening, reducer validation, atomic writes, evidence validation, remote verification, test hardening, schema integration",
      "title": "P0 \u7ed9\u4e8b\u4ef6\u548c\u6295\u5f71\u52a0\u786c\u6821\u9a8c"
    },
    "reviewer_notes": "All 50 tests pass. Schema validation is optional (jsonschema may not be installed). Atomic writes prevent corruption. Payload validation catches missing/invalid fields at append time.",
    "risks": "Schema hardening may reject existing event files; jsonschema optional so not a blocker; backward compatibility maintained",
    "scope": "GCW workflow engine scripts and schemas only; no product code changes",
    "self_review": {
      "progress_section": "All 7 phases complete",
      "recorded": true
    },
    "spec_refs": {
      "findings_sha": "sha256:8521fa01e1c0df7f38981b806cd295ecfd7ac644e94c938807bef30f2dd5cb1d",
      "progress_sha": "sha256:efe12a44387c20c387ae19f517b63f924d3bf365205141adcd79c22ff4d5e5f5",
      "task_plan_sha": "sha256:cbc4b21fc4d9672651693343d9c32244e0d7667b312d0189e5d418837198dbb9"
    }
  },
  "refs": {},
  "schema": "gcw.event/v1",
  "seq": 5
}
