{
  "actor": {
    "id": "cursor-session",
    "kind": "local"
  },
  "at": "2026-06-13T11:12:08Z",
  "event": "gcw-issue-intake",
  "event_id": "gcw-42-000-gcw-issue-intake",
  "parent": {
    "expected_last_seq": -1
  },
  "payload": {
    "branch": "feat/example-42",
    "issue": 42,
    "owner": {
      "id": "cursor-session",
      "kind": "local"
    },
    "platform": "github",
    "repository": "owner/repo"
  },
  "refs": {
    "branch": "feat/example-42",
    "issue": 42
  },
  "schema": "gcw.event/v1",
  "seq": 0
}
