{
  "actor": {
    "id": "cursor-session",
    "kind": "local"
  },
  "at": "2026-06-13T11:12:08Z",
  "event": "gcw-issue-to-spec",
  "event_id": "gcw-42-002-gcw-issue-to-spec",
  "parent": {
    "expected_last_seq": 1
  },
  "payload": {
    "planning_commit_pushed": true,
    "progress_comment_url": "https://github.com/owner/repo/issues/42#issuecomment-1",
    "spec_refs": {
      "findings_sha": "sha256:bd871bb61a66e46b4737e2cbb97dc50f9c180a1367d945c0e527685875b434a0",
      "progress_sha": "sha256:276b4ef60a7b236c88635f93903524eceb526fdfb3710b2a3621011710f79795",
      "task_plan_sha": "sha256:474fc868ea7cfd21619dc8a58130ecc642b721c8d9ede28a1b952d0ea1f056dd"
    }
  },
  "refs": {
    "base_branch": "",
    "branch": "feat/example-42",
    "issue": 42
  },
  "schema": "gcw.event/v1",
  "seq": 2
}
