{
  "actor": {
    "id": "cursor-session",
    "kind": "local"
  },
  "at": "2026-06-13T17:02:11Z",
  "event": "gcw-issue-to-spec",
  "event_id": "gcw-unknown-002-gcw-issue-to-spec",
  "parent": {
    "expected_last_seq": 1
  },
  "payload": {
    "planning_commit_pushed": true,
    "progress_comment_url": "",
    "spec_refs": {
      "findings_sha": "sha256:8521fa01e1c0df7f38981b806cd295ecfd7ac644e94c938807bef30f2dd5cb1d",
      "progress_sha": "sha256:6b68ba6c4f03e09cae2a7e5e8edcc111460e6002201e5c763db4c2eb12f19402",
      "task_plan_sha": "sha256:cbc4b21fc4d9672651693343d9c32244e0d7667b312d0189e5d418837198dbb9"
    }
  },
  "refs": {},
  "schema": "gcw.event/v1",
  "seq": 2
}
