{
  "actor": {
    "id": "cursor-session",
    "kind": "local"
  },
  "at": "2026-06-13T17:03:37Z",
  "event": "gcw-implement",
  "event_id": "gcw-unknown-004-gcw-implement",
  "parent": {
    "expected_last_seq": 3
  },
  "payload": {
    "work_summary": "Implementing hard validation for GCW events and projections: Phase 1 Schema hardening, Phase 2 Reducer hardening, Phase 3 Atomic writes, Phase 4 Evidence validation, Phase 5 Remote verification, Phase 6 Tests, Phase 7 Schema integration"
  },
  "refs": {},
  "schema": "gcw.event/v1",
  "seq": 4
}
